{"development":{"base_cost":null,"blockers":["formal_dataset_blocked","standard_cli_controlled_backtest_not_implemented"],"end":"2022-12-31","split":"development","start":"2018-01-01","status":"NOT_RUN_BLOCKED","stress_cost":null},"generated_at":"2026-08-28T12:18:46+08:00","locked_test_consumed":false,"locked_test_status":"NOT_RUN","remaining_blockers":["adjustment_factor:issues_present","adjustment_factor:missing_dates","adjustment_factor:status_partial","adjustment_factor:warmup_or_start_coverage_missing","capability_receipt_scope_not_formal_admission","corporate_action_entitlement_decomposition_out_of_scope","critical_check_failed:adjustment_point_in_time_valid","critical_check_failed:corporate_action_entitlements_complete","critical_check_failed:date_order_valid","critical_check_failed:dual_price_isolated","critical_check_failed:execution_states_complete","critical_check_failed:no_duplicate_primary_keys","critical_check_failed:pit_membership_complete","csi800_pit_membership:end_coverage_missing","csi800_pit_membership:issues_present","csi800_pit_membership:missing_dates","csi800_pit_membership:status_partial","csi800_pit_membership:warmup_or_start_coverage_missing","csi800_price_benchmark:issues_present","csi800_price_benchmark:missing_dates","csi800_price_benchmark:status_partial","csi800_price_benchmark:warmup_or_start_coverage_missing","delisted_residual_terminal_valuation_not_admitted","development:formal_dataset_blocked","development:standard_cli_controlled_backtest_not_implemented","historical_formal_batches_not_collected","name_and_st_history:content_hash_missing","name_and_st_history:end_coverage_missing","name_and_st_history:issues_present","name_and_st_history:missing_dates","name_and_st_history:no_records","name_and_st_history:status_missing","name_and_st_history:warmup_or_start_coverage_missing","price_limit_history:issues_present","price_limit_history:missing_dates","price_limit_history:status_invalid","price_limit_history:warmup_or_start_coverage_missing","raw_daily_bar:issues_present","raw_daily_bar:missing_dates","raw_daily_bar:status_partial","raw_daily_bar:warmup_or_start_coverage_missing","security_master:end_coverage_missing","security_master:issues_present","security_master:missing_dates","security_master:status_invalid","security_master:warmup_or_start_coverage_missing","standard_cli_raw_dataset_verification_not_implemented","suspension_history:issues_present","suspension_history:missing_dates","suspension_history:status_partial","suspension_history:warmup_or_start_coverage_missing","trade_calendar:issues_present","trade_calendar:missing_dates","trade_calendar:status_partial","trade_calendar:warmup_or_start_coverage_missing","validation:formal_dataset_blocked","validation:standard_cli_controlled_backtest_not_implemented"],"report_sha256":"7d31df5a3947486a905ae4f465987d5f313f4d41ea2af8245fc4ffbd237532f5","safety":{"automatic_order_submission":false,"live_supported":false,"paper_eligibility":false,"real_money_list_allowed":false,"trade_eligibility":false},"schema_version":"technical-momentum-backtest-report.v1","strategy_id":"a-share-technical-momentum-adaptive-v1","validation":{"base_cost":null,"blockers":["formal_dataset_blocked","standard_cli_controlled_backtest_not_implemented"],"end":"2023-12-31","split":"validation","start":"2023-01-01","status":"NOT_RUN_BLOCKED","stress_cost":null}}
